{
  "id": "550e8400-e29b-41d4-a716-446655440100",
  "name": "Silva & Associates Legal",
  "registrationNumber": "CNPJ12345678",
  "email": "contact@silvaassociates.com",
  "phone": "+551130001000",
  "website": "https://www.silvaassociates.com",
  "foundedDate": "2010-01-15",
  "size": "medium",
  "address": {
    "street": "Avenida Paulista",
    "streetNumber": "1500",
    "apartment": "Suite 2001",
    "city": "SÃ£o Paulo",
    "state": "SP",
    "postalCode": "01310-100",
    "country": "Brazil",
    "coordinates": {
      "latitude": -23.5629,
      "longitude": -46.6544
    }
  },
  "createdAt": "2023-01-10T10:00:00Z",
  "updatedAt": "2024-06-15T14:30:00Z"
}
